smartctl 5.43 2012-06-30 r3573 [x86_64-linux-3.8.0-33-generic] (local build)
Copyright (C) 2002-12 by Bruce Allen, http://smartmontools.sourceforge.net

=== START OF INFORMATION SECTION ===
Model Family:     Western Digital RE3 Serial ATA
Device Model:     WDC WD2502ABYS-01B7A0
Serial Number:    WD-WCAT11171165
LU WWN Device Id: 5 0014ee 1abb176db
Firmware Version: 02.03B02
User Capacity:    251,059,544,064 bytes [251 GB]
Sector Size:      512 bytes logical/physical
Device is:        In smartctl database [for details use: -P show]
ATA Version is:   8
ATA Standard is:  Exact ATA specification draft version not indicated
Local Time is:    Tue Mar 11 01:20:42 2014 UTC
SMART support is: Available - device has SMART capability.
SMART support is: Enabled
AAM level is:     254 (maximum performance), recommended: 128
APM feature is:   Unavailable
Rd look-ahead is: Enabled
Write cache is:   Enabled
ATA Security is:  Disabled, NOT FROZEN [SEC1]

=== START OF READ SMART DATA SECTION ===
SMART overall-health self-assessment test result: PASSED

General SMART Values:
Offline data collection status:  (0x84)	Offline data collection activity
					was suspended by an interrupting command from host.
					Auto Offline Data Collection: Enabled.
Self-test execution status:      (   0)	The previous self-test routine completed
					without error or no self-test has ever 
					been run.
Total time to complete Offline 
data collection: 		( 4800) seconds.
Offline data collection
capabilities: 			 (0x7b) SMART execute Offline immediate.
					Auto Offline data collection on/off support.
					Suspend Offline collection upon new
					command.
					Offline surface scan supported.
					Self-test supported.
					Conveyance Self-test supported.
					Selective Self-test supported.
SMART capabilities:            (0x0003)	Saves SMART data before entering
					power-saving mode.
					Supports SMART auto save timer.
Error logging capability:        (0x01)	Error logging supported.
					General Purpose Logging supported.
Short self-test routine 
recommended polling time: 	 (   2) minutes.
Extended self-test routine
recommended polling time: 	 (  59) minutes.
Conveyance self-test routine
recommended polling time: 	 (   5) minutes.
SCT capabilities: 	       (0x303f)	SCT Status supported.
					SCT Error Recovery Control supported.
					SCT Feature Control supported.
					SCT Data Table supported.

SMART Attributes Data Structure revision number: 16
Vendor Specific SMART Attributes with Thresholds:
ID# ATTRIBUTE_NAME          FLAGS    VALUE WORST THRESH FAIL RAW_VALUE
  1 Raw_Read_Error_Rate     POSR-K   200   200   051    -    1676
  3 Spin_Up_Time            POS--K   160   158   021    -    3000
  4 Start_Stop_Count        -O--CK   100   100   000    -    48
  5 Reallocated_Sector_Ct   PO--CK   200   200   140    -    0
  7 Seek_Error_Rate         -OSR-K   200   200   000    -    0
  9 Power_On_Hours          -O--CK   086   086   000    -    10262
 10 Spin_Retry_Count        -O--CK   100   253   000    -    0
 11 Calibration_Retry_Count -O--CK   100   253   000    -    0
 12 Power_Cycle_Count       -O--CK   100   100   000    -    48
192 Power-Off_Retract_Count -O--CK   200   200   000    -    46
193 Load_Cycle_Count        -O--CK   200   200   000    -    48
194 Temperature_Celsius     -O---K   113   101   000    -    30
196 Reallocated_Event_Count -O--CK   200   200   000    -    0
197 Current_Pending_Sector  -O--CK   200   200   000    -    0
198 Offline_Uncorrectable   ----CK   200   200   000    -    0
199 UDMA_CRC_Error_Count    -O--CK   200   200   000    -    0
200 Multi_Zone_Error_Rate   ---R--   200   200   000    -    0
                            ||||||_ K auto-keep
                            |||||__ C event count
                            ||||___ R error rate
                            |||____ S speed/performance
                            ||_____ O updated online
                            |______ P prefailure warning

General Purpose Log Directory Version 1
SMART           Log Directory Version 1 [multi-sector log support]
GP/S  Log at address 0x00 has    1 sectors [Log Directory]
SMART Log at address 0x01 has    1 sectors [Summary SMART error log]
SMART Log at address 0x02 has    5 sectors [Comprehensive SMART error log]
GP    Log at address 0x03 has    6 sectors [Ext. Comprehensive SMART error log]
SMART Log at address 0x06 has    1 sectors [SMART self-test log]
GP    Log at address 0x07 has    1 sectors [Extended self-test log]
SMART Log at address 0x09 has    1 sectors [Selective self-test log]
GP    Log at address 0x10 has    1 sectors [NCQ Command Error log]
GP    Log at address 0x11 has    1 sectors [SATA Phy Event Counters]
GP/S  Log at address 0x80 has   16 sectors [Host vendor specific log]
GP/S  Log at address 0x81 has   16 sectors [Host vendor specific log]
GP/S  Log at address 0x82 has   16 sectors [Host vendor specific log]
GP/S  Log at address 0x83 has   16 sectors [Host vendor specific log]
GP/S  Log at address 0x84 has   16 sectors [Host vendor specific log]
GP/S  Log at address 0x85 has   16 sectors [Host vendor specific log]
GP/S  Log at address 0x86 has   16 sectors [Host vendor specific log]
GP/S  Log at address 0x87 has   16 sectors [Host vendor specific log]
GP/S  Log at address 0x88 has   16 sectors [Host vendor specific log]
GP/S  Log at address 0x89 has   16 sectors [Host vendor specific log]
GP/S  Log at address 0x8a has   16 sectors [Host vendor specific log]
GP/S  Log at address 0x8b has   16 sectors [Host vendor specific log]
GP/S  Log at address 0x8c has   16 sectors [Host vendor specific log]
GP/S  Log at address 0x8d has   16 sectors [Host vendor specific log]
GP/S  Log at address 0x8e has   16 sectors [Host vendor specific log]
GP/S  Log at address 0x8f has   16 sectors [Host vendor specific log]
GP/S  Log at address 0x90 has   16 sectors [Host vendor specific log]
GP/S  Log at address 0x91 has   16 sectors [Host vendor specific log]
GP/S  Log at address 0x92 has   16 sectors [Host vendor specific log]
GP/S  Log at address 0x93 has   16 sectors [Host vendor specific log]
GP/S  Log at address 0x94 has   16 sectors [Host vendor specific log]
GP/S  Log at address 0x95 has   16 sectors [Host vendor specific log]
GP/S  Log at address 0x96 has   16 sectors [Host vendor specific log]
GP/S  Log at address 0x97 has   16 sectors [Host vendor specific log]
GP/S  Log at address 0x98 has   16 sectors [Host vendor specific log]
GP/S  Log at address 0x99 has   16 sectors [Host vendor specific log]
GP/S  Log at address 0x9a has   16 sectors [Host vendor specific log]
GP/S  Log at address 0x9b has   16 sectors [Host vendor specific log]
GP/S  Log at address 0x9c has   16 sectors [Host vendor specific log]
GP/S  Log at address 0x9d has   16 sectors [Host vendor specific log]
GP/S  Log at address 0x9e has   16 sectors [Host vendor specific log]
GP/S  Log at address 0x9f has   16 sectors [Host vendor specific log]
GP/S  Log at address 0xa0 has   16 sectors [Device vendor specific log]
GP/S  Log at address 0xa1 has   16 sectors [Device vendor specific log]
GP/S  Log at address 0xa2 has   16 sectors [Device vendor specific log]
GP/S  Log at address 0xa3 has   16 sectors [Device vendor specific log]
GP/S  Log at address 0xa4 has   16 sectors [Device vendor specific log]
GP/S  Log at address 0xa5 has   16 sectors [Device vendor specific log]
GP/S  Log at address 0xa6 has   16 sectors [Device vendor specific log]
GP/S  Log at address 0xa7 has   16 sectors [Device vendor specific log]
GP/S  Log at address 0xa8 has    1 sectors [Device vendor specific log]
GP/S  Log at address 0xa9 has    1 sectors [Device vendor specific log]
GP/S  Log at address 0xaa has    1 sectors [Device vendor specific log]
GP/S  Log at address 0xab has    1 sectors [Device vendor specific log]
GP/S  Log at address 0xac has    1 sectors [Device vendor specific log]
GP/S  Log at address 0xad has    1 sectors [Device vendor specific log]
GP/S  Log at address 0xae has    1 sectors [Device vendor specific log]
GP/S  Log at address 0xaf has    1 sectors [Device vendor specific log]
GP/S  Log at address 0xb0 has    1 sectors [Device vendor specific log]
GP/S  Log at address 0xb1 has    1 sectors [Device vendor specific log]
GP/S  Log at address 0xb2 has    1 sectors [Device vendor specific log]
GP/S  Log at address 0xb3 has    1 sectors [Device vendor specific log]
GP/S  Log at address 0xb4 has    1 sectors [Device vendor specific log]
GP/S  Log at address 0xb5 has    1 sectors [Device vendor specific log]
GP/S  Log at address 0xb6 has    1 sectors [Device vendor specific log]
GP/S  Log at address 0xb7 has    1 sectors [Device vendor specific log]
GP/S  Log at address 0xc0 has    1 sectors [Device vendor specific log]
GP    Log at address 0xc1 has   24 sectors [Device vendor specific log]
GP/S  Log at address 0xe0 has    1 sectors [SCT Command/Status]
GP/S  Log at address 0xe1 has    1 sectors [SCT Data Transfer]

SMART Extended Comprehensive Error Log Version: 1 (6 sectors)
Device Error Count: 1
	CR     = Command Register
	FEATR  = Features Register
	COUNT  = Count (was: Sector Count) Register
	LBA_48 = Upper bytes of LBA High/Mid/Low Registers ]  ATA-8
	LH     = LBA High (was: Cylinder High) Register    ]   LBA
	LM     = LBA Mid (was: Cylinder Low) Register      ] Register
	LL     = LBA Low (was: Sector Number) Register     ]
	DV     = Device (was: Device/Head) Register
	DC     = Device Control Register
	ER     = Error register
	ST     = Status register
Powered_Up_Time is measured from power on, and printed as
DDd+hh:mm:SS.sss where DD=days, hh=hours, mm=minutes,
SS=sec, and sss=millisec. It "wraps" after 49.710 days.

Error 1 [0] occurred at disk power-on lifetime: 9290 hours (387 days + 2 hours)
  When the command that caused the error occurred, the device was doing SMART Offline or Self-test.

  After command completion occurred, registers were:
  ER -- ST COUNT  LBA_48  LH LM LL DV DC
  -- -- -- == -- == == == -- -- -- -- --
  10 -- 51 00 00 00 01 9d 00 88 6b 40 00  Error: IDNF at LBA = 0x19d00886b = 6929025131

  Commands leading to the command that caused the error were:
  CR FEATR COUNT  LBA_48  LH LM LL DV DC  Powered_Up_Time  Command/Feature_Name
  -- == -- == -- == == == -- -- -- -- --  ---------------  --------------------
  61 00 04 00 00 00 00 01 88 9d 6b 40 00 15d+03:44:15.299  WRITE FPDMA QUEUED
  61 00 01 00 00 00 00 0a cc 36 bc 40 00 15d+03:44:15.180  WRITE FPDMA QUEUED
  61 00 03 00 00 00 00 0a cc 36 b8 40 00 15d+03:44:15.180  WRITE FPDMA QUEUED
  61 00 01 00 00 00 00 0a cc 36 b5 40 00 15d+03:44:15.179  WRITE FPDMA QUEUED
  61 00 01 00 00 00 00 0a cc 36 ae 40 00 15d+03:44:15.173  WRITE FPDMA QUEUED

SMART Extended Self-test Log Version: 1 (1 sectors)
Num  Test_Description    Status                  Remaining  LifeTime(hours)  LBA_of_first_error
# 1  Extended offline    Completed without error       00%      9611         -
# 2  Short offline       Completed without error       00%      9404         -
# 3  Short offline       Completed without error       00%      9398         -
# 4  Short offline       Completed without error       00%      9392         -
# 5  Short offline       Completed without error       00%      9386         -
# 6  Short offline       Completed without error       00%      9380         -
# 7  Short offline       Completed without error       00%      9374         -
# 8  Short offline       Completed without error       00%      9368         -
# 9  Short offline       Completed without error       00%      9362         -
#10  Short offline       Completed without error       00%      9356         -
#11  Short offline       Completed without error       00%      9350         -
#12  Short offline       Completed without error       00%      9344         -
#13  Short offline       Completed without error       00%      9338         -
#14  Short offline       Completed without error       00%      9332         -
#15  Short offline       Completed without error       00%      9326         -
#16  Short offline       Completed without error       00%      9320         -
#17  Short offline       Completed without error       00%      9314         -
#18  Short offline       Completed without error       00%      9308         -

SMART Selective self-test log data structure revision number 1
 SPAN  MIN_LBA  MAX_LBA  CURRENT_TEST_STATUS
    1        0        0  Not_testing
    2        0        0  Not_testing
    3        0        0  Not_testing
    4        0        0  Not_testing
    5        0        0  Not_testing
Selective self-test flags (0x0):
  After scanning selected spans, do NOT read-scan remainder of disk.
If Selective self-test is pending on power-up, resume after 0 minute delay.

SCT Status Version:                  2
SCT Version (vendor specific):       258 (0x0102)
SCT Support Level:                   1
Device State:                        SMART Off-line Data Collection executing in background (4)
Current Temperature:                    30 Celsius
Power Cycle Min/Max Temperature:     24/33 Celsius
Lifetime    Min/Max Temperature:     20/42 Celsius
Under/Over Temperature Limit Count:   0/0
SCT Temperature History Version:     2
Temperature Sampling Period:         1 minute
Temperature Logging Interval:        1 minute
Min/Max recommended Temperature:      0/60 Celsius
Min/Max Temperature Limit:           -41/85 Celsius
Temperature History Size (Index):    478 (366)

Index    Estimated Time   Temperature Celsius
 367    2014-03-10 17:23    28  *********
 ...    ..( 32 skipped).    ..  *********
 400    2014-03-10 17:56    28  *********
 401    2014-03-10 17:57    29  **********
 ...    ..(193 skipped).    ..  **********
 117    2014-03-10 21:11    29  **********
 118    2014-03-10 21:12    30  ***********
 ...    ..(220 skipped).    ..  ***********
 339    2014-03-11 00:53    30  ***********
 340    2014-03-11 00:54    28  *********
 ...    ..( 25 skipped).    ..  *********
 366    2014-03-11 01:20    28  *********

Error SMART WRITE LOG does not return COUNT and LBA_LOW register
Warning: device does not support SCT (Get) Error Recovery Control command

SATA Phy Event Counters (GP Log 0x11)
ID      Size     Value  Description
0x0001  2            0  Command failed due to ICRC error
0x0002  2            0  R_ERR response for data FIS
0x0003  2            0  R_ERR response for device-to-host data FIS
0x0004  2            0  R_ERR response for host-to-device data FIS
0x0005  2            0  R_ERR response for non-data FIS
0x0006  2            0  R_ERR response for device-to-host non-data FIS
0x0007  2            0  R_ERR response for host-to-device non-data FIS
0x000a  2            0  Device-to-host register FISes sent due to a COMRESET
0x8000  4       432262  Vendor specific

