smartctl 5.43 2012-06-30 r3573 [x86_64-linux-3.8.0-33-generic] (local build)
Copyright (C) 2002-12 by Bruce Allen, http://smartmontools.sourceforge.net

=== START OF INFORMATION SECTION ===
Model Family:     Western Digital RE3 Serial ATA
Device Model:     WDC WD2502ABYS-01B7A0
Serial Number:    WD-WCAT1A484673
LU WWN Device Id: 5 0014ee 15711a336
Firmware Version: 02.03B02
User Capacity:    251,059,544,064 bytes [251 GB]
Sector Size:      512 bytes logical/physical
Device is:        In smartctl database [for details use: -P show]
ATA Version is:   8
ATA Standard is:  Exact ATA specification draft version not indicated
Local Time is:    Tue Mar 11 01:19:51 2014 UTC
SMART support is: Available - device has SMART capability.
SMART support is: Enabled
AAM level is:     254 (maximum performance), recommended: 128
APM feature is:   Unavailable
Rd look-ahead is: Enabled
Write cache is:   Enabled
ATA Security is:  Disabled, NOT FROZEN [SEC1]

=== START OF READ SMART DATA SECTION ===
SMART overall-health self-assessment test result: PASSED

General SMART Values:
Offline data collection status:  (0x84)	Offline data collection activity
					was suspended by an interrupting command from host.
					Auto Offline Data Collection: Enabled.
Self-test execution status:      (   0)	The previous self-test routine completed
					without error or no self-test has ever 
					been run.
Total time to complete Offline 
data collection: 		( 4800) seconds.
Offline data collection
capabilities: 			 (0x7b) SMART execute Offline immediate.
					Auto Offline data collection on/off support.
					Suspend Offline collection upon new
					command.
					Offline surface scan supported.
					Self-test supported.
					Conveyance Self-test supported.
					Selective Self-test supported.
SMART capabilities:            (0x0003)	Saves SMART data before entering
					power-saving mode.
					Supports SMART auto save timer.
Error logging capability:        (0x01)	Error logging supported.
					General Purpose Logging supported.
Short self-test routine 
recommended polling time: 	 (   2) minutes.
Extended self-test routine
recommended polling time: 	 (  59) minutes.
Conveyance self-test routine
recommended polling time: 	 (   5) minutes.
SCT capabilities: 	       (0x303f)	SCT Status supported.
					SCT Error Recovery Control supported.
					SCT Feature Control supported.
					SCT Data Table supported.

SMART Attributes Data Structure revision number: 16
Vendor Specific SMART Attributes with Thresholds:
ID# ATTRIBUTE_NAME          FLAGS    VALUE WORST THRESH FAIL RAW_VALUE
  1 Raw_Read_Error_Rate     POSR-K   200   200   051    -    0
  3 Spin_Up_Time            POS--K   200   200   021    -    958
  4 Start_Stop_Count        -O--CK   100   100   000    -    42
  5 Reallocated_Sector_Ct   PO--CK   200   200   140    -    0
  7 Seek_Error_Rate         -OSR-K   200   200   000    -    0
  9 Power_On_Hours          -O--CK   051   051   000    -    36312
 10 Spin_Retry_Count        -O--CK   100   253   000    -    0
 11 Calibration_Retry_Count -O--CK   100   253   000    -    0
 12 Power_Cycle_Count       -O--CK   100   100   000    -    39
192 Power-Off_Retract_Count -O--CK   200   200   000    -    36
193 Load_Cycle_Count        -O--CK   200   200   000    -    42
194 Temperature_Celsius     -O---K   114   101   000    -    29
196 Reallocated_Event_Count -O--CK   200   200   000    -    0
197 Current_Pending_Sector  -O--CK   200   200   000    -    0
198 Offline_Uncorrectable   ----CK   200   200   000    -    0
199 UDMA_CRC_Error_Count    -O--CK   200   200   000    -    0
200 Multi_Zone_Error_Rate   ---R--   200   200   000    -    0
                            ||||||_ K auto-keep
                            |||||__ C event count
                            ||||___ R error rate
                            |||____ S speed/performance
                            ||_____ O updated online
                            |______ P prefailure warning

General Purpose Log Directory Version 1
SMART           Log Directory Version 1 [multi-sector log support]
GP/S  Log at address 0x00 has    1 sectors [Log Directory]
SMART Log at address 0x01 has    1 sectors [Summary SMART error log]
SMART Log at address 0x02 has    5 sectors [Comprehensive SMART error log]
GP    Log at address 0x03 has    6 sectors [Ext. Comprehensive SMART error log]
SMART Log at address 0x06 has    1 sectors [SMART self-test log]
GP    Log at address 0x07 has    1 sectors [Extended self-test log]
SMART Log at address 0x09 has    1 sectors [Selective self-test log]
GP    Log at address 0x10 has    1 sectors [NCQ Command Error log]
GP    Log at address 0x11 has    1 sectors [SATA Phy Event Counters]
GP/S  Log at address 0x80 has   16 sectors [Host vendor specific log]
GP/S  Log at address 0x81 has   16 sectors [Host vendor specific log]
GP/S  Log at address 0x82 has   16 sectors [Host vendor specific log]
GP/S  Log at address 0x83 has   16 sectors [Host vendor specific log]
GP/S  Log at address 0x84 has   16 sectors [Host vendor specific log]
GP/S  Log at address 0x85 has   16 sectors [Host vendor specific log]
GP/S  Log at address 0x86 has   16 sectors [Host vendor specific log]
GP/S  Log at address 0x87 has   16 sectors [Host vendor specific log]
GP/S  Log at address 0x88 has   16 sectors [Host vendor specific log]
GP/S  Log at address 0x89 has   16 sectors [Host vendor specific log]
GP/S  Log at address 0x8a has   16 sectors [Host vendor specific log]
GP/S  Log at address 0x8b has   16 sectors [Host vendor specific log]
GP/S  Log at address 0x8c has   16 sectors [Host vendor specific log]
GP/S  Log at address 0x8d has   16 sectors [Host vendor specific log]
GP/S  Log at address 0x8e has   16 sectors [Host vendor specific log]
GP/S  Log at address 0x8f has   16 sectors [Host vendor specific log]
GP/S  Log at address 0x90 has   16 sectors [Host vendor specific log]
GP/S  Log at address 0x91 has   16 sectors [Host vendor specific log]
GP/S  Log at address 0x92 has   16 sectors [Host vendor specific log]
GP/S  Log at address 0x93 has   16 sectors [Host vendor specific log]
GP/S  Log at address 0x94 has   16 sectors [Host vendor specific log]
GP/S  Log at address 0x95 has   16 sectors [Host vendor specific log]
GP/S  Log at address 0x96 has   16 sectors [Host vendor specific log]
GP/S  Log at address 0x97 has   16 sectors [Host vendor specific log]
GP/S  Log at address 0x98 has   16 sectors [Host vendor specific log]
GP/S  Log at address 0x99 has   16 sectors [Host vendor specific log]
GP/S  Log at address 0x9a has   16 sectors [Host vendor specific log]
GP/S  Log at address 0x9b has   16 sectors [Host vendor specific log]
GP/S  Log at address 0x9c has   16 sectors [Host vendor specific log]
GP/S  Log at address 0x9d has   16 sectors [Host vendor specific log]
GP/S  Log at address 0x9e has   16 sectors [Host vendor specific log]
GP/S  Log at address 0x9f has   16 sectors [Host vendor specific log]
GP/S  Log at address 0xa0 has   16 sectors [Device vendor specific log]
GP/S  Log at address 0xa1 has   16 sectors [Device vendor specific log]
GP/S  Log at address 0xa2 has   16 sectors [Device vendor specific log]
GP/S  Log at address 0xa3 has   16 sectors [Device vendor specific log]
GP/S  Log at address 0xa4 has   16 sectors [Device vendor specific log]
GP/S  Log at address 0xa5 has   16 sectors [Device vendor specific log]
GP/S  Log at address 0xa6 has   16 sectors [Device vendor specific log]
GP/S  Log at address 0xa7 has   16 sectors [Device vendor specific log]
GP/S  Log at address 0xa8 has    1 sectors [Device vendor specific log]
GP/S  Log at address 0xa9 has    1 sectors [Device vendor specific log]
GP/S  Log at address 0xaa has    1 sectors [Device vendor specific log]
GP/S  Log at address 0xab has    1 sectors [Device vendor specific log]
GP/S  Log at address 0xac has    1 sectors [Device vendor specific log]
GP/S  Log at address 0xad has    1 sectors [Device vendor specific log]
GP/S  Log at address 0xae has    1 sectors [Device vendor specific log]
GP/S  Log at address 0xaf has    1 sectors [Device vendor specific log]
GP/S  Log at address 0xb0 has    1 sectors [Device vendor specific log]
GP/S  Log at address 0xb1 has    1 sectors [Device vendor specific log]
GP/S  Log at address 0xb2 has    1 sectors [Device vendor specific log]
GP/S  Log at address 0xb3 has    1 sectors [Device vendor specific log]
GP/S  Log at address 0xb4 has    1 sectors [Device vendor specific log]
GP/S  Log at address 0xb5 has    1 sectors [Device vendor specific log]
GP    Log at address 0xb6 has    1 sectors [Device vendor specific log]
GP/S  Log at address 0xb7 has    1 sectors [Device vendor specific log]
GP/S  Log at address 0xc0 has    1 sectors [Device vendor specific log]
GP    Log at address 0xc1 has   24 sectors [Device vendor specific log]
GP/S  Log at address 0xe0 has    1 sectors [SCT Command/Status]
GP/S  Log at address 0xe1 has    1 sectors [SCT Data Transfer]

SMART Extended Comprehensive Error Log Version: 1 (6 sectors)
No Errors Logged

SMART Extended Self-test Log Version: 1 (1 sectors)
Num  Test_Description    Status                  Remaining  LifeTime(hours)  LBA_of_first_error
# 1  Extended offline    Completed without error       00%     35662         -
# 2  Short offline       Completed without error       00%     35337         -
# 3  Short offline       Completed without error       00%     35331         -
# 4  Short offline       Completed without error       00%     35325         -
# 5  Short offline       Completed without error       00%     35319         -
# 6  Short offline       Completed without error       00%     35313         -
# 7  Short offline       Completed without error       00%     35307         -
# 8  Short offline       Completed without error       00%     35301         -
# 9  Short offline       Completed without error       00%     35295         -
#10  Short offline       Completed without error       00%     35289         -
#11  Short offline       Completed without error       00%     35284         -
#12  Short offline       Completed without error       00%     35278         -
#13  Short offline       Completed without error       00%     35272         -
#14  Short offline       Completed without error       00%     35266         -
#15  Short offline       Completed without error       00%     35260         -
#16  Short offline       Completed without error       00%     35254         -
#17  Short offline       Completed without error       00%     35248         -
#18  Short offline       Completed without error       00%     35242         -

SMART Selective self-test log data structure revision number 1
 SPAN  MIN_LBA  MAX_LBA  CURRENT_TEST_STATUS
    1        0        0  Not_testing
    2        0        0  Not_testing
    3        0        0  Not_testing
    4        0        0  Not_testing
    5        0        0  Not_testing
Selective self-test flags (0x0):
  After scanning selected spans, do NOT read-scan remainder of disk.
If Selective self-test is pending on power-up, resume after 0 minute delay.

SCT Status Version:                  2
SCT Version (vendor specific):       258 (0x0102)
SCT Support Level:                   1
Device State:                        SMART Off-line Data Collection executing in background (4)
Current Temperature:                    29 Celsius
Power Cycle Min/Max Temperature:     24/29 Celsius
Lifetime    Min/Max Temperature:     23/42 Celsius
Under/Over Temperature Limit Count:   0/0
SCT Temperature History Version:     2
Temperature Sampling Period:         1 minute
Temperature Logging Interval:        1 minute
Min/Max recommended Temperature:      0/60 Celsius
Min/Max Temperature Limit:           -41/85 Celsius
Temperature History Size (Index):    478 (2)

Index    Estimated Time   Temperature Celsius
   3    2014-03-10 17:22    29  **********
 ...    ..(215 skipped).    ..  **********
 219    2014-03-10 20:58    29  **********
 220    2014-03-10 20:59    27  ********
 ...    ..(116 skipped).    ..  ********
 337    2014-03-10 22:56    27  ********
 338    2014-03-10 22:57    28  *********
 ...    ..( 36 skipped).    ..  *********
 375    2014-03-10 23:34    28  *********
 376    2014-03-10 23:35    27  ********
 ...    ..( 12 skipped).    ..  ********
 389    2014-03-10 23:48    27  ********
 390    2014-03-10 23:49    28  *********
 ...    ..( 16 skipped).    ..  *********
 407    2014-03-11 00:06    28  *********
 408    2014-03-11 00:07    29  **********
 ...    ..( 71 skipped).    ..  **********
   2    2014-03-11 01:19    29  **********

Error SMART WRITE LOG does not return COUNT and LBA_LOW register
Warning: device does not support SCT (Get) Error Recovery Control command

SATA Phy Event Counters (GP Log 0x11)
ID      Size     Value  Description
0x0001  2            0  Command failed due to ICRC error
0x0002  2            0  R_ERR response for data FIS
0x0003  2            0  R_ERR response for device-to-host data FIS
0x0004  2            0  R_ERR response for host-to-device data FIS
0x0005  2            0  R_ERR response for non-data FIS
0x0006  2            0  R_ERR response for device-to-host non-data FIS
0x0007  2            0  R_ERR response for host-to-device non-data FIS
0x000a  2            0  Device-to-host register FISes sent due to a COMRESET
0x8000  4       432180  Vendor specific

