smartctl 5.43 2012-06-30 r3573 [x86_64-linux-3.8.0-33-generic] (local build)
Copyright (C) 2002-12 by Bruce Allen, http://smartmontools.sourceforge.net

=== START OF INFORMATION SECTION ===
Model Family:     Western Digital RE3 Serial ATA
Device Model:     WDC WD2502ABYS-01B7A0
Serial Number:    WD-WCAT19726727
LU WWN Device Id: 5 0014ee 156fd2d07
Firmware Version: 02.03B02
User Capacity:    251,059,544,064 bytes [251 GB]
Sector Size:      512 bytes logical/physical
Device is:        In smartctl database [for details use: -P show]
ATA Version is:   8
ATA Standard is:  Exact ATA specification draft version not indicated
Local Time is:    Tue Mar 11 01:19:08 2014 UTC
SMART support is: Available - device has SMART capability.
SMART support is: Enabled
AAM level is:     254 (maximum performance), recommended: 128
APM feature is:   Unavailable
Rd look-ahead is: Enabled
Write cache is:   Enabled
ATA Security is:  Disabled, NOT FROZEN [SEC1]

=== START OF READ SMART DATA SECTION ===
SMART overall-health self-assessment test result: PASSED

General SMART Values:
Offline data collection status:  (0x84)	Offline data collection activity
					was suspended by an interrupting command from host.
					Auto Offline Data Collection: Enabled.
Self-test execution status:      (   0)	The previous self-test routine completed
					without error or no self-test has ever 
					been run.
Total time to complete Offline 
data collection: 		( 4800) seconds.
Offline data collection
capabilities: 			 (0x7b) SMART execute Offline immediate.
					Auto Offline data collection on/off support.
					Suspend Offline collection upon new
					command.
					Offline surface scan supported.
					Self-test supported.
					Conveyance Self-test supported.
					Selective Self-test supported.
SMART capabilities:            (0x0003)	Saves SMART data before entering
					power-saving mode.
					Supports SMART auto save timer.
Error logging capability:        (0x01)	Error logging supported.
					General Purpose Logging supported.
Short self-test routine 
recommended polling time: 	 (   2) minutes.
Extended self-test routine
recommended polling time: 	 (  59) minutes.
Conveyance self-test routine
recommended polling time: 	 (   5) minutes.
SCT capabilities: 	       (0x303f)	SCT Status supported.
					SCT Error Recovery Control supported.
					SCT Feature Control supported.
					SCT Data Table supported.

SMART Attributes Data Structure revision number: 16
Vendor Specific SMART Attributes with Thresholds:
ID# ATTRIBUTE_NAME          FLAGS    VALUE WORST THRESH FAIL RAW_VALUE
  1 Raw_Read_Error_Rate     POSR-K   200   200   051    -    0
  3 Spin_Up_Time            POS--K   200   200   021    -    966
  4 Start_Stop_Count        -O--CK   100   100   000    -    106
  5 Reallocated_Sector_Ct   PO--CK   200   200   140    -    0
  7 Seek_Error_Rate         -OSR-K   200   200   000    -    0
  9 Power_On_Hours          -O--CK   064   064   000    -    26593
 10 Spin_Retry_Count        -O--CK   100   100   000    -    0
 11 Calibration_Retry_Count -O--CK   100   100   000    -    0
 12 Power_Cycle_Count       -O--CK   100   100   000    -    103
192 Power-Off_Retract_Count -O--CK   200   200   000    -    101
193 Load_Cycle_Count        -O--CK   200   200   000    -    106
194 Temperature_Celsius     -O---K   113   091   000    -    30
196 Reallocated_Event_Count -O--CK   200   200   000    -    0
197 Current_Pending_Sector  -O--CK   200   200   000    -    0
198 Offline_Uncorrectable   ----CK   200   200   000    -    0
199 UDMA_CRC_Error_Count    -O--CK   200   200   000    -    0
200 Multi_Zone_Error_Rate   ---R--   200   200   000    -    0
                            ||||||_ K auto-keep
                            |||||__ C event count
                            ||||___ R error rate
                            |||____ S speed/performance
                            ||_____ O updated online
                            |______ P prefailure warning

General Purpose Log Directory Version 1
SMART           Log Directory Version 1 [multi-sector log support]
GP/S  Log at address 0x00 has    1 sectors [Log Directory]
SMART Log at address 0x01 has    1 sectors [Summary SMART error log]
SMART Log at address 0x02 has    5 sectors [Comprehensive SMART error log]
GP    Log at address 0x03 has    6 sectors [Ext. Comprehensive SMART error log]
SMART Log at address 0x06 has    1 sectors [SMART self-test log]
GP    Log at address 0x07 has    1 sectors [Extended self-test log]
SMART Log at address 0x09 has    1 sectors [Selective self-test log]
GP    Log at address 0x10 has    1 sectors [NCQ Command Error log]
GP    Log at address 0x11 has    1 sectors [SATA Phy Event Counters]
GP/S  Log at address 0x80 has   16 sectors [Host vendor specific log]
GP/S  Log at address 0x81 has   16 sectors [Host vendor specific log]
GP/S  Log at address 0x82 has   16 sectors [Host vendor specific log]
GP/S  Log at address 0x83 has   16 sectors [Host vendor specific log]
GP/S  Log at address 0x84 has   16 sectors [Host vendor specific log]
GP/S  Log at address 0x85 has   16 sectors [Host vendor specific log]
GP/S  Log at address 0x86 has   16 sectors [Host vendor specific log]
GP/S  Log at address 0x87 has   16 sectors [Host vendor specific log]
GP/S  Log at address 0x88 has   16 sectors [Host vendor specific log]
GP/S  Log at address 0x89 has   16 sectors [Host vendor specific log]
GP/S  Log at address 0x8a has   16 sectors [Host vendor specific log]
GP/S  Log at address 0x8b has   16 sectors [Host vendor specific log]
GP/S  Log at address 0x8c has   16 sectors [Host vendor specific log]
GP/S  Log at address 0x8d has   16 sectors [Host vendor specific log]
GP/S  Log at address 0x8e has   16 sectors [Host vendor specific log]
GP/S  Log at address 0x8f has   16 sectors [Host vendor specific log]
GP/S  Log at address 0x90 has   16 sectors [Host vendor specific log]
GP/S  Log at address 0x91 has   16 sectors [Host vendor specific log]
GP/S  Log at address 0x92 has   16 sectors [Host vendor specific log]
GP/S  Log at address 0x93 has   16 sectors [Host vendor specific log]
GP/S  Log at address 0x94 has   16 sectors [Host vendor specific log]
GP/S  Log at address 0x95 has   16 sectors [Host vendor specific log]
GP/S  Log at address 0x96 has   16 sectors [Host vendor specific log]
GP/S  Log at address 0x97 has   16 sectors [Host vendor specific log]
GP/S  Log at address 0x98 has   16 sectors [Host vendor specific log]
GP/S  Log at address 0x99 has   16 sectors [Host vendor specific log]
GP/S  Log at address 0x9a has   16 sectors [Host vendor specific log]
GP/S  Log at address 0x9b has   16 sectors [Host vendor specific log]
GP/S  Log at address 0x9c has   16 sectors [Host vendor specific log]
GP/S  Log at address 0x9d has   16 sectors [Host vendor specific log]
GP/S  Log at address 0x9e has   16 sectors [Host vendor specific log]
GP/S  Log at address 0x9f has   16 sectors [Host vendor specific log]
GP/S  Log at address 0xa0 has   16 sectors [Device vendor specific log]
GP/S  Log at address 0xa1 has   16 sectors [Device vendor specific log]
GP/S  Log at address 0xa2 has   16 sectors [Device vendor specific log]
GP/S  Log at address 0xa3 has   16 sectors [Device vendor specific log]
GP/S  Log at address 0xa4 has   16 sectors [Device vendor specific log]
GP/S  Log at address 0xa5 has   16 sectors [Device vendor specific log]
GP/S  Log at address 0xa6 has   16 sectors [Device vendor specific log]
GP/S  Log at address 0xa7 has   16 sectors [Device vendor specific log]
GP/S  Log at address 0xa8 has    1 sectors [Device vendor specific log]
GP/S  Log at address 0xa9 has    1 sectors [Device vendor specific log]
GP/S  Log at address 0xaa has    1 sectors [Device vendor specific log]
GP/S  Log at address 0xab has    1 sectors [Device vendor specific log]
GP/S  Log at address 0xac has    1 sectors [Device vendor specific log]
GP/S  Log at address 0xad has    1 sectors [Device vendor specific log]
GP/S  Log at address 0xae has    1 sectors [Device vendor specific log]
GP/S  Log at address 0xaf has    1 sectors [Device vendor specific log]
GP/S  Log at address 0xb0 has    1 sectors [Device vendor specific log]
GP/S  Log at address 0xb1 has    1 sectors [Device vendor specific log]
GP/S  Log at address 0xb2 has    1 sectors [Device vendor specific log]
GP/S  Log at address 0xb3 has    1 sectors [Device vendor specific log]
GP/S  Log at address 0xb4 has    1 sectors [Device vendor specific log]
GP/S  Log at address 0xb5 has    1 sectors [Device vendor specific log]
GP    Log at address 0xb6 has    1 sectors [Device vendor specific log]
GP/S  Log at address 0xb7 has    1 sectors [Device vendor specific log]
GP/S  Log at address 0xc0 has    1 sectors [Device vendor specific log]
GP    Log at address 0xc1 has   24 sectors [Device vendor specific log]
GP/S  Log at address 0xe0 has    1 sectors [SCT Command/Status]
GP/S  Log at address 0xe1 has    1 sectors [SCT Data Transfer]

SMART Extended Comprehensive Error Log Version: 1 (6 sectors)
No Errors Logged

SMART Extended Self-test Log Version: 1 (1 sectors)
Num  Test_Description    Status                  Remaining  LifeTime(hours)  LBA_of_first_error
# 1  Extended offline    Completed without error       00%     25942         -
# 2  Short offline       Completed without error       00%     25735         -
# 3  Short offline       Completed without error       00%     25729         -
# 4  Short offline       Completed without error       00%     25723         -
# 5  Short offline       Completed without error       00%     25718         -
# 6  Short offline       Completed without error       00%     25712         -
# 7  Short offline       Completed without error       00%     25706         -
# 8  Short offline       Completed without error       00%     25700         -
# 9  Short offline       Completed without error       00%     25694         -
#10  Short offline       Completed without error       00%     25688         -
#11  Short offline       Completed without error       00%     25682         -
#12  Short offline       Completed without error       00%     25676         -
#13  Short offline       Completed without error       00%     25670         -
#14  Short offline       Completed without error       00%     25664         -
#15  Short offline       Completed without error       00%     25658         -
#16  Short offline       Completed without error       00%     25652         -
#17  Short offline       Completed without error       00%     25646         -
#18  Short offline       Completed without error       00%     25640         -

SMART Selective self-test log data structure revision number 1
 SPAN  MIN_LBA  MAX_LBA  CURRENT_TEST_STATUS
    1        0        0  Not_testing
    2        0        0  Not_testing
    3        0        0  Not_testing
    4        0        0  Not_testing
    5        0        0  Not_testing
Selective self-test flags (0x0):
  After scanning selected spans, do NOT read-scan remainder of disk.
If Selective self-test is pending on power-up, resume after 0 minute delay.

SCT Status Version:                  2
SCT Version (vendor specific):       258 (0x0102)
SCT Support Level:                   1
Device State:                        SMART Off-line Data Collection executing in background (4)
Current Temperature:                    30 Celsius
Power Cycle Min/Max Temperature:     25/30 Celsius
Lifetime    Min/Max Temperature:     24/51 Celsius
Under/Over Temperature Limit Count:   0/0
SCT Temperature History Version:     2
Temperature Sampling Period:         1 minute
Temperature Logging Interval:        1 minute
Min/Max recommended Temperature:      0/60 Celsius
Min/Max Temperature Limit:           -41/85 Celsius
Temperature History Size (Index):    478 (86)

Index    Estimated Time   Temperature Celsius
  87    2014-03-10 17:22    30  ***********
 ...    ..( 15 skipped).    ..  ***********
 103    2014-03-10 17:38    30  ***********
 104    2014-03-10 17:39    28  *********
 ...    ..( 19 skipped).    ..  *********
 124    2014-03-10 17:59    28  *********
 125    2014-03-10 18:00    29  **********
 ...    ..( 10 skipped).    ..  **********
 136    2014-03-10 18:11    29  **********
 137    2014-03-10 18:12    28  *********
 ...    ..( 28 skipped).    ..  *********
 166    2014-03-10 18:41    28  *********
 167    2014-03-10 18:42    29  **********
 ...    ..(188 skipped).    ..  **********
 356    2014-03-10 21:51    29  **********
 357    2014-03-10 21:52    30  ***********
 ...    ..(206 skipped).    ..  ***********
  86    2014-03-11 01:19    30  ***********

Error SMART WRITE LOG does not return COUNT and LBA_LOW register
Warning: device does not support SCT (Get) Error Recovery Control command

SATA Phy Event Counters (GP Log 0x11)
ID      Size     Value  Description
0x0001  2            0  Command failed due to ICRC error
0x0002  2            0  R_ERR response for data FIS
0x0003  2            0  R_ERR response for device-to-host data FIS
0x0004  2            0  R_ERR response for host-to-device data FIS
0x0005  2            0  R_ERR response for non-data FIS
0x0006  2            0  R_ERR response for device-to-host non-data FIS
0x0007  2            0  R_ERR response for host-to-device non-data FIS
0x000a  2            0  Device-to-host register FISes sent due to a COMRESET
0x8000  4       432133  Vendor specific

